{
  "status": "passed",
  "hasProblems": false,
  "hasBlockingProblems": false,
  "logCount": 2,
  "warningCount": 1,
  "errorCount": 0,
  "exceptionCount": 0,
  "assertCount": 0,
  "ignoredProblemCount": 0,
  "blockingProblemCount": 0,
  "lastProblem": null,
  "watchedCount": 1,
  "watchedLogs": [
    {
      "line": 3,
      "type": "Warning",
      "message": "Example warning for agent review",
      "sequence": 3,
      "playModeFrame": 112,
      "scenePath": "Assets/Scenes/Login.unity"
    }
  ],
  "startedAt": "2026-06-30T18:30:14Z",
  "endedAt": "2026-06-30T18:31:02Z",
  "durationMs": 48000,
  "failedReason": null,
  "runs": [
    {
      "runIndex": 1,
      "startedAt": "2026-06-30T18:30:16.100Z",
      "endedAt": "2026-06-30T18:31:01.500Z",
      "sequenceStart": 2,
      "sequenceEnd": 4,
      "logCount": 1,
      "problemCount": 0,
      "blockingProblemCount": 0
    }
  ],
  "manualInterventionDetected": false
}
